{
  "comparison_id": "cmp_c9ebedc40d40b6126f87",
  "contract_version": "1.0.0",
  "company_id": "company_demo",
  "decision_subject_id": "subject_water_optimization",
  "dimensions": [
    {
      "name": "cost",
      "unit": "AUD",
      "weight": 1,
      "dimension_id": "dim_cost",
      "direction": "minimize",
      "normalization": "minmax",
      "bounds": null,
      "missing_policy": "unknown",
      "objective_refs": [],
      "preference_key": "comparison.cost.weight"
    },
    {
      "name": "time",
      "unit": "days",
      "weight": 1.3,
      "dimension_id": "dim_time",
      "direction": "minimize",
      "normalization": "minmax",
      "bounds": null,
      "missing_policy": "unknown",
      "objective_refs": [],
      "preference_key": "comparison.time.weight"
    },
    {
      "name": "quality",
      "weight": 1,
      "dimension_id": "dim_quality",
      "direction": "maximize",
      "normalization": "minmax",
      "bounds": null,
      "missing_policy": "unknown",
      "unit": null,
      "objective_refs": [],
      "preference_key": "comparison.quality.weight"
    },
    {
      "name": "risk",
      "weight": 1,
      "dimension_id": "dim_risk",
      "direction": "minimize",
      "normalization": "minmax",
      "bounds": null,
      "missing_policy": "unknown",
      "unit": null,
      "objective_refs": [],
      "preference_key": "comparison.risk.weight"
    },
    {
      "name": "benefit",
      "weight": 1,
      "dimension_id": "dim_benefit",
      "direction": "maximize",
      "normalization": "minmax",
      "bounds": null,
      "missing_policy": "unknown",
      "unit": null,
      "objective_refs": [],
      "preference_key": "comparison.benefit.weight"
    },
    {
      "name": "sustainability",
      "weight": 1.4,
      "dimension_id": "dim_sustainability",
      "direction": "maximize",
      "normalization": "minmax",
      "bounds": null,
      "missing_policy": "unknown",
      "unit": null,
      "objective_refs": [],
      "preference_key": "comparison.sustainability.weight"
    },
    {
      "name": "reversibility",
      "weight": 1,
      "dimension_id": "dim_reversibility",
      "direction": "maximize",
      "normalization": "minmax",
      "bounds": null,
      "missing_policy": "unknown",
      "unit": null,
      "objective_refs": [],
      "preference_key": "comparison.reversibility.weight"
    },
    {
      "name": "confidence",
      "normalization": "bounded",
      "bounds": {
        "min": 0,
        "max": 1
      },
      "weight": 1,
      "dimension_id": "dim_confidence",
      "direction": "maximize",
      "missing_policy": "unknown",
      "unit": null,
      "objective_refs": [],
      "preference_key": "comparison.confidence.weight"
    },
    {
      "name": "reliability",
      "normalization": "bounded",
      "bounds": {
        "min": 0,
        "max": 1
      },
      "weight": 1,
      "dimension_id": "dim_reliability",
      "direction": "maximize",
      "missing_policy": "unknown",
      "unit": null,
      "objective_refs": [],
      "preference_key": "comparison.reliability.weight"
    },
    {
      "name": "strategic_value",
      "weight": 1,
      "dimension_id": "dim_strategic_value",
      "direction": "maximize",
      "normalization": "minmax",
      "bounds": null,
      "missing_policy": "unknown",
      "unit": null,
      "objective_refs": [],
      "preference_key": "comparison.strategic_value.weight"
    }
  ],
  "alternatives": [
    {
      "option_id": "opt_supplier",
      "kind": "supplier",
      "title": "Outsource to specialist supplier",
      "eligible": true,
      "measurements": [
        {
          "raw_value": 42000,
          "confidence": 0.9,
          "evidence_refs": [
            "ev_quote"
          ],
          "status": "estimated",
          "dimension_id": "dim_cost",
          "unit": null,
          "assumptions": [],
          "normalized_score": 0.3833333333333333
        },
        {
          "raw_value": 14,
          "confidence": 0.8,
          "evidence_refs": [
            "ev_lead"
          ],
          "status": "estimated",
          "dimension_id": "dim_time",
          "unit": null,
          "assumptions": [],
          "normalized_score": 0.56
        },
        {
          "raw_value": 8,
          "confidence": 0.75,
          "evidence_refs": [
            "ev_supplier"
          ],
          "status": "estimated",
          "dimension_id": "dim_quality",
          "unit": null,
          "assumptions": [],
          "normalized_score": 0.6666666666666666
        },
        {
          "raw_value": 4,
          "confidence": 0.7,
          "evidence_refs": [
            "ev_risk"
          ],
          "status": "estimated",
          "dimension_id": "dim_risk",
          "unit": null,
          "assumptions": [],
          "normalized_score": 0.0
        },
        {
          "raw_value": 7,
          "confidence": 0.75,
          "evidence_refs": [
            "ev_benefit"
          ],
          "status": "estimated",
          "dimension_id": "dim_benefit",
          "unit": null,
          "assumptions": [],
          "normalized_score": 0.4
        },
        {
          "raw_value": 6,
          "confidence": 0.7,
          "evidence_refs": [
            "ev_env"
          ],
          "status": "estimated",
          "dimension_id": "dim_sustainability",
          "unit": null,
          "assumptions": [],
          "normalized_score": 0.2
        },
        {
          "raw_value": 8,
          "confidence": 0.8,
          "evidence_refs": [
            "ev_contract"
          ],
          "status": "estimated",
          "dimension_id": "dim_reversibility",
          "unit": null,
          "assumptions": [],
          "normalized_score": 0.6666666666666666
        },
        {
          "raw_value": 0.74,
          "confidence": 0.74,
          "evidence_refs": [
            "ev_bundle"
          ],
          "status": "estimated",
          "dimension_id": "dim_confidence",
          "unit": null,
          "assumptions": [],
          "normalized_score": 0.74
        },
        {
          "raw_value": 0.82,
          "confidence": 0.8,
          "evidence_refs": [
            "ev_supplier"
          ],
          "status": "estimated",
          "dimension_id": "dim_reliability",
          "unit": null,
          "assumptions": [],
          "normalized_score": 0.82
        },
        {
          "raw_value": 6,
          "confidence": 0.7,
          "evidence_refs": [
            "ev_strategy"
          ],
          "status": "estimated",
          "dimension_id": "dim_strategic_value",
          "unit": null,
          "assumptions": [],
          "normalized_score": 0.3333333333333333
        }
      ],
      "coverage": 1.0,
      "comparison_confidence": 0.762617,
      "weighted_profile": {
        "cost": 0.3833333333333333,
        "time": 0.7280000000000001,
        "quality": 0.6666666666666666,
        "risk": 0.0,
        "benefit": 0.4,
        "sustainability": 0.27999999999999997,
        "reversibility": 0.6666666666666666,
        "confidence": 0.74,
        "reliability": 0.82,
        "strategic_value": 0.3333333333333333
      },
      "dominance": {
        "dominates": [],
        "dominated_by": []
      }
    },
    {
      "option_id": "opt_intervention",
      "kind": "intervention",
      "title": "Install recirculation stage",
      "eligible": true,
      "measurements": [
        {
          "raw_value": 65000,
          "confidence": 0.88,
          "evidence_refs": [
            "ev_capex"
          ],
          "status": "estimated",
          "dimension_id": "dim_cost",
          "unit": null,
          "assumptions": [],
          "normalized_score": 0.0
        },
        {
          "raw_value": 28,
          "confidence": 0.75,
          "evidence_refs": [
            "ev_install"
          ],
          "status": "estimated",
          "dimension_id": "dim_time",
          "unit": null,
          "assumptions": [],
          "normalized_score": 0.0
        },
        {
          "raw_value": 9,
          "confidence": 0.85,
          "evidence_refs": [
            "ev_quality"
          ],
          "status": "estimated",
          "dimension_id": "dim_quality",
          "unit": null,
          "assumptions": [],
          "normalized_score": 1.0
        },
        {
          "raw_value": 3,
          "confidence": 0.8,
          "evidence_refs": [
            "ev_risk"
          ],
          "status": "estimated",
          "dimension_id": "dim_risk",
          "unit": null,
          "assumptions": [],
          "normalized_score": 0.5
        },
        {
          "raw_value": 10,
          "confidence": 0.88,
          "evidence_refs": [
            "ev_water_audit"
          ],
          "status": "estimated",
          "dimension_id": "dim_benefit",
          "unit": null,
          "assumptions": [],
          "normalized_score": 1.0
        },
        {
          "raw_value": 10,
          "confidence": 0.9,
          "evidence_refs": [
            "ev_env"
          ],
          "status": "estimated",
          "dimension_id": "dim_sustainability",
          "unit": null,
          "assumptions": [],
          "normalized_score": 1.0
        },
        {
          "raw_value": 4,
          "confidence": 0.75,
          "evidence_refs": [
            "ev_engineering"
          ],
          "status": "estimated",
          "dimension_id": "dim_reversibility",
          "unit": null,
          "assumptions": [],
          "normalized_score": 0.0
        },
        {
          "raw_value": 0.86,
          "confidence": 0.86,
          "evidence_refs": [
            "ev_bundle"
          ],
          "status": "estimated",
          "dimension_id": "dim_confidence",
          "unit": null,
          "assumptions": [],
          "normalized_score": 0.86
        },
        {